record_id,paper_id,issue_url,title,body,comments,state,created_at,decision
ase2022_towards_understanding_the_faults_of:cadd39705fa39164,ase2022_towards_understanding_the_faults_of,https://github.com/tensorflow/tfjs/issues/3823,error 'backend' undefined on a single model with tfjs@2.3.0,"anyone tried using openimages_v4/ssd/mobilenet_v2 <https://tfhub.dev/google/openimages_v4/ssd/mobilenet_v2/1> model from tfhub and tfjs 2.0+ ?i've converted it using:```shelltensorflowjs_converter --input_format tf_hub --output_format tfjs_graph_model --skip_op_check --strip_debug_ops=True --weight_shard_size_bytes 4194304 https://tfhub.dev/google/openimages_v4/ssd/mobilenet_v2/1 .```and it works perfectly with tfjs@1.7.4.  but with tfjs@2.3.0, it processes one image just fine and then it fails on the second image with```logTypeError: Cannot read property 'backend' of undefined```I've tried ~10 other models, some native tfjs and some converted from tfhub and none have this issue.","['@vladmandic I tried this model, but I am having trouble getting it run properly. do you mind sharing a codepen example of this model? Thanks.=====', ""> @vladmandic I tried this model, but I am having trouble getting it run properly. do you mind sharing a codepen example of this model? Thanks.It's a bit long for codepen, but you can see entire source of my project at <https://github.com/vladmandic/pigallery>key code is in function `client/modelDetect.js:detectSSD()`model is executed using:```jsconst result = await model.executeAsync({ images: batched }, [    'module_apply_default/hub_input/strided_slice_1',    'module_apply_default/hub_input/strided_slice_2',    'module_apply_default/hub_input/strided_slice'  ]),```where batched is an image buffer cast to float32 and afterwards it's just logic to decode classes and detection boxes.  outputs are arrays of scores, classes, boxes.  classes are in `assets/OpenImage-Labels.json`  ====="", ""touch more info on the error:  stack trace:```logUncaught (in promise) TypeError: Cannot read property 'backend' of undefined    at Engine.moveData (engine.js:270)    at DataStorage.get (backend.js:29)    at MathBackendWebGL.reshape (backend_webgl.js:1729)    at forward (reshape.js:55)    at engine.js:465    at engine.js:308    at Engine.scopedRun (engine.js:318)    at Engine.tidy (engine.js:307)    at kernelFunc (engine.js:465)    at engine.js:477```problematic code:```jsmoveData(backend, dataId) {  const info = this.state.tensorInfo.get(dataId), // this works fine on first execute, but returns undefined second time execute is called  const srcBackend = info.backend,  const values = this.readSync(dataId),```- dataId is always empty object, so that doesn't change- during first execute, moveData is called 183 times without issues- during second execute, moveData is called 22 times before info becomes undefined- but this.state.tensorInfo looks like a WeakMap with fixed 2890 entriesi've added this debug code after get function:```jsif (!info) {             console.log('dataId', dataId),  console.log('state', this.state),  console.log('tensorInfo', this.state.tensorInfo),  console.log('info', this.state.tensorInfo.get({}))}```and you can see the output:```logdataId {}state EngineState\xa0{registeredVariables: {…}, nextTapeNodeId: 0, numBytes: 88874728, numTensors: 1479, numStringTensors: 1,\xa0…}tensorInfo WeakMap\xa0{{…} => {…}, {…} => {…}, {…} => {…}, {…} => {…}, {…} => {…},\xa0…}info undefined```and just to confirm, tf.backend() and tf.getBackend() are valid before and after error (using webgl).i don't think there is anything wrong with moveData per say, as same this.state.tensorInfo.get(dataId) gets used all over the code  but it does seem that tensor map gets corrupt so getter fails to find value and by it's design it returns undefined  ====="", ""There are no immediate problems I can spot, but there are tensor leaks, added couple dispose calls:```typescriptasync function detectCOCO(model, image) {  const imgBuf = tf.browser.fromPixels(image, 3),  const expanded = tf.expandDims(imgBuf, 0),  let batched,  if (!model.config.useFloat) {    batched = expanded,  } else {    const cast = tf.cast(expanded, 'float32'),    batched = tf.mul(cast, [1.0 / 255.0]),    tf.dispose(cast),    tf.dispose(expanded),  }  const result = await model.executeAsync(batched),  const [scores, classes] = calculateMaxScores(result),  const reshaped = tf.tensor2d(result[1].dataSync(), [result[1].shape[1], result[1].shape[3]]),  tf.dispose(result),  // const index = tf.image.nonMaxSuppression(reshaped, scores, model.config.topK, model.config.overlap, model.config.score, model.config.softNmsSigma), // async version leaks 2 tensors  const index = await tf.image.nonMaxSuppressionAsync(reshaped, scores, model.config.topK, model.config.overlap, model.config.score, model.config.softNmsSigma),  const results = buildDetectedObjects(model, batched, result, scores, classes, index), // disposes of batched, result, index  tf.dispose(imgBuf),  tf.dispose(reshaped),  tf.dispose(index),  return results,}```====="", ""@vladmandic can you try to disable cpu forwarding through this flag:```typescripttf.env().setFlag('WEBGL_CPU_FORWARD', false),```====="", ""@pyu10055 FYI, Function used for OpenImages model is `detectSSD()`, not `detectCoco()`, but that shouldn't matter.I've added additional dispose calls in both (except for `index` as that one is disposed of later in `buildDetectedObjects()`).Anyhow, I've tried with `tf.ENV.set('WEBGL_CPU_FORWARD', false),` - no change, still fails on second image.Then as a test I've tried disabling anything I could think of:```js  tf.ENV.set('WEBGL_BUFFER_SUPPORTED', false),  tf.ENV.set('WEBGL_CONV_IM2COL', false),  tf.ENV.set('WEBGL_CPU_FORWARD', false),  tf.ENV.set('WEBGL_FENCE_API_ENABLED', false),  tf.ENV.set('WEBGL_FORCE_F16_TEXTURES', false),  tf.ENV.set('WEBGL_LAZILY_UNPACK', false),  tf.ENV.set('WEBGL_PACK', false),  tf.ENV.set('WEBGL_PACK_ARRAY_OPERATIONS', false),  tf.ENV.set('WEBGL_PACK_BINARY_OPERATIONS', false),  tf.ENV.set('WEBGL_PACK_CLIP', false),  tf.ENV.set('WEBGL_PACK_DEPTHWISECONV', false),  tf.ENV.set('WEBGL_PACK_IMAGE_OPERATIONS', false),  tf.ENV.set('WEBGL_PACK_UNARY_OPERATIONS', false),```Still no change - fails while processing second image.And as a last test, I've tried executing two models sequentially in a large loop (CocoSSDv2 and OpenImages) while wrapping execute call in try...catch block.Well, CocoSSDv2 model continues processing following 100+ images even after OpenImages fails - this shows that actual backend is perfectly fine.And once OpenImages model fails (always on a second image), there is no way to bring it back to consistent state but to reload from scratch.====="", 'This might be an issue with the op implementation that used by OpenImage model, do you mind providing a simple demo that runs this model? I can try to identify the problematic op. thanks=====', ""@pyu10055 I've created minimalistic project at <https://github.com/vladmandic/openimages>  and you can run it directly from git pages <https://vladmandic.github.io/openimages/>  (weights and media samples are included and tfjs is loaded from cdnjs so it's 100% self-sufficient)====="", '@vladmandic Thank you for setting up the demo, I have found the issue, and submit a PR for the fix.=====', 'Are you satisfied with the resolution of your issue?<a href=""https://docs.google.com/forms/d/e/1FAIpQLSfaP12TRhd9xSxjXZjcZFNXPGk4kc1-qMdv3gc6bEP90vY1ew/viewform?entry.85265664=Yes&entry.2137816233=https://github.com/tensorflow/tfjs/issues/3823"">Yes</a><a href=""https://docs.google.com/forms/d/e/1FAIpQLSfaP12TRhd9xSxjXZjcZFNXPGk4kc1-qMdv3gc6bEP90vY1ew/viewform?entry.85265664=No&entry.2137816233=https://github.com/tensorflow/tfjs/issues/3823"">No</a>=====', ""@pyu10055 Nice & Thank you!I went to get the diff, but it's already been reviewed and checked into master - impressive.I've done a checkout and clean build and can confirm that it works perfectly!I'm closing this issue.=====""]",closed,2020-08-18T17:26:02+00:00,rejected_candidate
ase2022_towards_understanding_the_faults_of:d2cd172fd2aa0847,ase2022_towards_understanding_the_faults_of,https://github.com/tensorflow/tfjs/pull/4042,e2e custom bundling for dense models.,"- Adds a e2e test for a CUJ covering creating a custom bundle with a Dense model that was trained with tfjs_layers and converted with tfjs_converter (these two steps are not part of the test as they are covered by other tests). The model is the created here https://github.com/tensorflow/tfjs-examples/tree/master/getting-started.- This e2e test also covers a locally hosted model (vs the blazeface one which loads a model hosted on GCP)- Adds a code path to test custom bundling with rollup- Modularizes CPU kernels necessary for dense models. BatchMatMul, _FusedBatchMatMul, relu, relu6 & preluTo see the logs from the Cloud Build CI, please join either our [discussion](https://groups.google.com/a/tensorflow.org/forum/#!forum/tfjs) or [announcement](https://groups.google.com/a/tensorflow.org/forum/#!forum/tfjs-announce) mailing list.<!-- Reviewable:start -->---This change is [<img src=""https://reviewable.io/review_button.svg"" height=""34"" align=""absmiddle"" alt=""Reviewable""/>](https://reviewable.io/reviews/tensorflow/tfjs/4042)<!-- Reviewable:end -->","[""The gradient has been updated to handle non 3d tensorsNotes after diving down many a rabbit hole:A rather strange bug manifests when moving the tensor transformation in mat_mul into the forward func. - The following test fails if you reshape the output inside the forward func: https://github.com/tensorflow/tfjs/pull/4042/files#diff-cc708fab06d0a3dc8632cff94b269533  - This is actually a test of debug mode. IMO the profiler fails to execute the kernel correctly  - This only happens in WebGL2 (works just fine in the webgl1 testEnv)  - It *might* be because the forwardFunc has a mix of modularized and unmodularized kernels including a reshape that increments the backend refcounter. This is speculation, but is driven by seeing that in debug mode, while trying to profile the forwardFunc, an error is thrown claiming a there is a memory leak in BatchMatMul on webgl. This may prevent the profile function from finishing which leaves a value uninitialized causing the test to fail (the profiler throughs a null pointer exception)  - I've currently skipped it in this PR to demonstrate that all the other tests pass (including the webgl tests for matMul itself)I was trying not to modularize webgl batchmatmul in the same PR to keep the PR size down, but that may be the most practical option to see if we can bring that test back.====="", ""Thanks for the info @annxingyuan. I'm also going to hold off of changing the fused mat_mul kernel interface in this PR. We can do that as an enhancement in future PRs. In that case this ready for re-review.=====""]",closed,2020-10-08T15:02:05+00:00,rejected_candidate
ase2022_towards_understanding_the_faults_of:d2f20f41f01e5dc1,ase2022_towards_understanding_the_faults_of,https://github.com/tensorflow/tfjs/issues/2599,Version instruction conflict( AVX tfjs restrict non-AVX CPU from running),what is the latest  version of tensorflowjs/tfjs-node that able no AVX support CPU's to run without 'Illegal instruction error'.A version that is not AVX support specific. Seens that these versions are restricting non-AVX support to workout.,['@JMRwork it would be tfjs-node v1.2.1 and prior. AVX support was introduced by tensorflow C library v1.14.0 and be introduced to tfjs-node at https://github.com/tensorflow/tfjs-node/pull/261. So tfjs-node published before this PR has no AVX support.====='],closed,2019-12-20T03:05:53+00:00,rejected_candidate
ase2022_towards_understanding_the_faults_of:da63d3c67960ed02,ase2022_towards_understanding_the_faults_of,https://github.com/tensorflow/tfjs/issues/5013,TFJS converter mismanages EfficientDet models 2,"Efficientdet  can't be used , it relates to #3903, but seems to be a completely different oneFor this  [model](https://tfhub.dev/tensorflow/efficientdet/d0/1)## Converted the following way```tensorflowjs_converter \    --input_format=tf_hub  \    --output_format=tfjs_graph_model \    --signature_name=serving_default \    --saved_model_tags=serve \    ./efficientdet_d0_1 ./web_model_tfhub```## Loaded and executed as follows in a browser```const model = await tf.loadGraphModel(""web_model_tfhub/model.json""),t = tf.browser.fromPixels(img).expandDims(0)let output = await model.executeAsync(t)```## Results in```Uncaught Error: FusedConv2d and DepthwiseConv2d with BiasAdd must have one extra argument: bias.    at UO (tfjs@2.7.0:17)    at tfjs@2.7.0:17    at tfjs@2.7.0:17    at tfjs@2.7.0:17    at e.t.scopedRun (tfjs@2.7.0:17)    at e.t.tidy (tfjs@2.7.0:17)    at lx (tfjs@2.7.0:17)    at tfjs@2.7.0:17    at KO (tfjs@2.7.0:17)    at p (tfjs@2.7.0:17)```Same when the model is taken from the official repo.Tried both tfjs version 2.7.0 , which was released just after #3903 was resolved , and 3.6.0, the result is the same","['@partus I was able to convert and run the TFJS model without errors. Please make sure your tensorflowjs pip is the same version (3.6.0) as the tfjs library. =====', 'What versions of other packages are relevant? : I am running it on Arch linux, hence the most recent tensorflow + python as well, e.g. tensorflow with python 3.9... is not officially supported. Which are the important dependencies so that I will I will put it into a cantainer, Hopefully  veryify that it’s fine. Then with the next step we might verify the issue in a container with upgraded versions =====', ""@partus Have you resolved this issue, I've countered the same one. Change tfjs version and tensorflowjs won't work```Uncaught Error: FusedConv2d and DepthwiseConv2d with BiasAdd must have one extra argument: bias.```====="", '@Linh0704 , @pyu10055  I was able to convert and run the tfhub version with python 3.8 instead of 3.9, and tfjs 3.6.0 , but I was unable to run the model from the official repo. Did not dive into it further as decided to run the model on a server.=====', 'Closing the issue , please mention@ if you need further help to reopen. Thank you =====', 'Are you satisfied with the resolution of your issue?<a href=""https://docs.google.com/forms/d/e/1FAIpQLSfaP12TRhd9xSxjXZjcZFNXPGk4kc1-qMdv3gc6bEP90vY1ew/viewform?entry.85265664=Yes&entry.2137816233=https://github.com/tensorflow/tfjs/issues/5013"">Yes</a><a href=""https://docs.google.com/forms/d/e/1FAIpQLSfaP12TRhd9xSxjXZjcZFNXPGk4kc1-qMdv3gc6bEP90vY1ew/viewform?entry.85265664=No&entry.2137816233=https://github.com/tensorflow/tfjs/issues/5013"">No</a>=====']",closed,2021-04-29T14:16:17+00:00,accepted_fault
ase2022_towards_understanding_the_faults_of:dcaff281abf056f0,ase2022_towards_understanding_the_faults_of,https://github.com/justadudewhohacks/face-api.js/issues/831,Matching faces between iOS (swift) and javascript,Hi; great work and thanks; this library has been an awesome easy inclusion to our solution.however; now we need to implement the same tensor models to find faces and the 68 landmarks on iOS devices using swift. To do so; we would prefer to convert the appropriate models to coreml using apples python converter.I’ve been trying to use the true converter to convert the js models back to the original models to load into python; but having a few issues. Could you provide any pointers? Do you have the original tf saved models or know where they are so we aren’t converting backwards?thanks so much again and keep up the great work!,['To be clear; we are intending to try and match people identified in a photo on one platform against people in different photos on the other platform; so we need to use the same models in both environments.Thanks again!====='],open,2021-12-04T23:43:22+00:00,accepted_fault
ase2022_towards_understanding_the_faults_of:decbda77c371bce4,ase2022_towards_understanding_the_faults_of,https://github.com/tensorflow/tfjs/issues/4902,Memory Leak in TensorCamera when remounting repeatedly,"**System information**- Have I written custom code (as opposed to using a stock example script provided in TensorFlow.js): Yes- OS Platform and Distribution (e.g., Linux Ubuntu 16.04): React Native 0.63.4- Mobile device (e.g. iPhone 8, Pixel 2, Samsung Galaxy) if the issue happens on mobile device: iPhone 8 Plus- TensorFlow.js installed from (npm or script link): npm- TensorFlow.js version (use command below): 3.0.0- Browser version:- Tensorflow.js Converter Version:**Describe the current behavior**I have the [TensorCamera](https://js.tensorflow.org/api_react_native/0.5.0/#cameraWithTensors) for React Native mounted on a tab in my [Tab Navigator](https://reactnavigation.org/docs/bottom-tab-navigator/). Switching between tabs causes the total memory usage to increase every time TensorCamera is remounted. I've narrowed the memory leak down to the Tensorcamera as replacing it with Expo Camera caused no memory leaks when switching between tabs. I've also commented out the onReady function so it shouldn't be related to undisposed tensors.**Describe the expected behavior**Re-mouting the TensorCamera shouldn't cause memory leaks**Standalone code to reproduce the issue**Provide a reproducible test case that is the bare minimum necessary to generatethe problem. If possible, please share a link to Colab/CodePen/any notebook.```const TensorCamera = cameraWithTensors(Camera),```...```               <TensorCamera                  ref={cameraRef}                  style={styles.camera}                  type={Camera.Constants.Type.back}                  zoom={0}                  cameraTextureHeight={textureDims.height}                  cameraTextureWidth={textureDims.width}                  resizeHeight={tensorDims.height}                  resizeWidth={tensorDims.width}                  resizeDepth={3}                  onReady={handleCameraStream}                  autorender={true}                />```**Other info / logs** Include any logs or source code that would be helpful todiagnose the problem. If including tracebacks, please include the fulltraceback. Large logs and files should be attached.![IMG_2767](https://user-images.githubusercontent.com/44853346/113497214-e40b0280-94cf-11eb-8042-7723f8b6c887.PNG)![IMG_2770](https://user-images.githubusercontent.com/44853346/113497220-e79e8980-94cf-11eb-85bb-5e5af8ef86c0.PNG)","[""I face the same issue, i opened a ticket here : https://github.com/tensorflow/tfjs/issues/4846I then tracked down the leak to expo-gl's method createCameraTextureAsync() ( used in TensorCamera ). I wrote a ticket there too : https://github.com/expo/expo/issues/12468=====""]",open,2021-04-04T02:53:54+00:00,accepted_fault
ase2022_towards_understanding_the_faults_of:dff28973bc28c898,ase2022_towards_understanding_the_faults_of,https://github.com/tensorflow/tfjs/pull/4875,Move cloud functions to central location and update googleapis,"This PR also removes an old cloud function used in `tensorflow/tfjs-core`'s CI, which is no longer needed since `tfjs-core` is part of the monorepo. It also fixes [CVE-2020-7720](https://nvd.nist.gov/vuln/detail/CVE-2020-7720) by updating googleapis.To see the logs from the Cloud Build CI, please join either our [discussion](https://groups.google.com/a/tensorflow.org/forum/#!forum/tfjs) or [announcement](https://groups.google.com/a/tensorflow.org/forum/#!forum/tfjs-announce) mailing list.<!-- Reviewable:start -->---This change is [<img src=""https://reviewable.io/review_button.svg"" height=""34"" align=""absmiddle"" alt=""Reviewable""/>](https://reviewable.io/reviews/tensorflow/tfjs/4875)<!-- Reviewable:end -->",[],closed,2021-03-29T17:58:58+00:00,rejected_candidate
ase2022_towards_understanding_the_faults_of:e03731760da3d848,ase2022_towards_understanding_the_faults_of,https://github.com/tensorflow/tfjs/pull/2855,fixing g3 sync error,"To see the logs from the Cloud Build CI, please join either our [discussion](https://groups.google.com/a/tensorflow.org/forum/#!forum/tfjs) or [announcement](https://groups.google.com/a/tensorflow.org/forum/#!forum/tfjs-announce) mailing list.<!-- Reviewable:start -->---This change is [<img src=""https://reviewable.io/review_button.svg"" height=""34"" align=""absmiddle"" alt=""Reviewable""/>](https://reviewable.io/reviews/tensorflow/tfjs/2855)<!-- Reviewable:end -->",[],closed,2020-03-09T22:19:45+00:00,rejected_candidate
ase2022_towards_understanding_the_faults_of:e09c9f5168ad88b4,ase2022_towards_understanding_the_faults_of,https://github.com/tensorflow/tfjs/issues/5574,How to convert microphone input(arraybuffer/blob/audio in javascript) to tensor for inference at browser?,"Hi tensors,I have recently started working on TensorflowJS. Agenda is to make web app for speech model.But I am confused and getting stuck, How to preprocess speech(microphone) input?In python, we have packages to preprocess the input. But how can I convert microphone input ( from browser, it is ArrayBuffer or Blob) into tensors. Some suggestions will be very appreciated. Thanks.","['please check this codelab https://codelabs.developers.google.com/codelabs/tensorflowjs-audio-codelab#0 , Thank you.=====', 'Are you satisfied with the resolution of your issue?<a href=""https://docs.google.com/forms/d/e/1FAIpQLSfaP12TRhd9xSxjXZjcZFNXPGk4kc1-qMdv3gc6bEP90vY1ew/viewform?entry.85265664=Yes&entry.2137816233=https://github.com/tensorflow/tfjs/issues/5574"">Yes</a><a href=""https://docs.google.com/forms/d/e/1FAIpQLSfaP12TRhd9xSxjXZjcZFNXPGk4kc1-qMdv3gc6bEP90vY1ew/viewform?entry.85265664=No&entry.2137816233=https://github.com/tensorflow/tfjs/issues/5574"">No</a>=====']",closed,2021-09-02T12:14:36+00:00,accepted_fault
ase2022_towards_understanding_the_faults_of:e78fd2806f426951,ase2022_towards_understanding_the_faults_of,https://github.com/justadudewhohacks/face-api.js/issues/794,TypeError: t.toFloat is not a function TensorFlow with React,trying to run face-api.js on react appNetInput.js:139 Uncaught (in promise) TypeError: t.toFloat is not a function    at NetInput.js:139    at Array.map (<anonymous>)    at NetInput.js:139    at engine.js:327    at Engine.scopedRun (engine.js:337)    at Engine.tidy (engine.js:326)    at Module.tidy (globals.js:175)    at NetInput../face-api.js/node_modules/tfjs-image-recognition-base/build/es6/dom/NetInput.js.NetInput.toBatchTensor (NetInput.js:123)    at SsdMobilenetv1.ts:30    at engine.js:327,"[""`* is not a function` for any tensorflow function pretty much always comes down to tensorflow backend not registered correctly. which again comes down to multiple incompatible versions of tensorflow being used.  if you're using `tfjs` 2.x or 3.x; you'll end up with this because original `face-api` has not not been updated for a long time and includes embedded `tfjs` v1 which is NOT compatible with tfjs 2.x or tfjs 3.x.that's main reason why this port exists: <https://github.com/vladmandic/face-api>=====""]",closed,2021-05-12T15:47:54+00:00,accepted_fault
